{
  "$schema": "https://json-schema.org/draft/2020-12/schema",
  "title": "misconception_library_entry",
  "description": "One game's full misconception catalog. Contains one entry per error category documented for this game and concept. Used by Misconception Architect, Loop Purity Auditor, Teacher Evidence Dashboard, and clean-replay design. See docs/os_spec_2026.md Section 4.1.",
  "type": "object",
  "required": ["game_name", "game_family", "concept", "age_band", "math_domain", "misconceptions"],
  "additionalProperties": false,
  "properties": {
    "game_name": {
      "type": "string",
      "description": "Human-readable game title. e.g. 'Bakery Rush'."
    },
    "game_family": {
      "type": "string",
      "description": "Interaction family from the OS taxonomy. e.g. 'combine_and_build'."
    },
    "concept": {
      "type": "string",
      "description": "The specific mathematical concept this game teaches. e.g. 'additive decomposition'."
    },
    "age_band": {
      "type": "string",
      "description": "Target age range. e.g. '7-10'."
    },
    "math_domain": {
      "type": "string",
      "description": "Broad math domain. e.g. 'Number and Operations — Addition'."
    },
    "misconceptions": {
      "type": "array",
      "minItems": 1,
      "description": "All documented misconceptions for this game. Should cover all six required error categories (procedure_slip, concept_confusion, representation_mismatch, impulsive_guess, rule_misunderstanding, strategic_overload).",
      "items": {
        "type": "object",
        "required": [
          "id",
          "category",
          "label",
          "description",
          "likely_cause",
          "how_it_appears_in_play",
          "detection_signal",
          "best_feedback_response",
          "best_clean_replay_task",
          "reflection_prompt"
        ],
        "additionalProperties": false,
        "properties": {
          "id": {
            "type": "string",
            "pattern": "^[a-z0-9_-]+$",
            "description": "Unique slug within this entry. e.g. 'bakery_impulsive_tap'."
          },
          "category": {
            "type": "string",
            "enum": [
              "procedure_slip",
              "concept_confusion",
              "representation_mismatch",
              "impulsive_guess",
              "rule_misunderstanding",
              "strategic_overload"
            ],
            "description": "Which of the six required error categories this misconception belongs to."
          },
          "label": {
            "type": "string",
            "minLength": 1,
            "description": "Short human-readable name for this misconception. e.g. 'Tap before tracking'."
          },
          "description": {
            "type": "string",
            "minLength": 10,
            "description": "What the learner believes or does wrong. State the misunderstanding, not just the behavior."
          },
          "likely_cause": {
            "type": "string",
            "minLength": 10,
            "description": "Why a learner develops this error. Cognitive or instructional root, not just 'they didn't know'."
          },
          "how_it_appears_in_play": {
            "type": "string",
            "minLength": 10,
            "description": "What an observer would see. Specific, behavioral, distinguishable from other error categories."
          },
          "detection_signal": {
            "type": "string",
            "minLength": 5,
            "description": "What the game can measure or observe to classify this error. Should be implementable without camera or audio. e.g. 'tap interval < 400ms on 3+ consecutive items'."
          },
          "best_feedback_response": {
            "type": "string",
            "minLength": 10,
            "description": "The most effective immediate response to this error. Must name what to notice or do differently — not just 'try again'."
          },
          "best_clean_replay_task": {
            "type": "string",
            "minLength": 10,
            "description": "A simpler version of the challenge that isolates the exact misunderstanding. Should be achievable in under 60 seconds."
          },
          "reflection_prompt": {
            "type": "string",
            "minLength": 10,
            "description": "One short question to ask the learner after this error repeats twice or more. Tied to the planning/monitoring/evaluation framework."
          }
        }
      }
    }
  }
}
